title,subtitle,snippet,keywords,category
How to Quit Porn Without Going Cold Turkey,Build momentum step-by-step.,"Sustainable behavioral change, particularly in overcoming deeply ingrained habits, is demonstrably more effective through a gradual, incremental approach rather than abrupt cessation. This step-by-step methodology, focusing on building positive momentum, aligns with extensive research in habit formation and addiction recovery. Experts in behavioral science consistently advocate for such phased strategies, as they foster lasting transformation by allowing for the development of new, healthier patterns over time.","quit porn slowly, tapering porn, step by step porn recovery",Productivity & Lifestyle
What Successful Quitters Do Differently,"The habits, mindsets, and systems that work.","Successful long-term cessation is widely understood to stem not merely from initial resolve, but from a strategic integration of specific behavioral patterns and cognitive frameworks. Indeed, expert consensus consistently points to the adoption of supportive habits, the cultivation of resilient mindsets, and the establishment of robust personal systems as critical differentiators among those who achieve lasting freedom from dependencies. This evidence-based approach suggests that sustained change is fundamentally a learned process, emphasizing actionable strategies over singular acts of willpower for profound transformation.","successful porn recovery, nofap habits, quit porn systems",Productivity & Lifestyle
Top 5 Porn Blocker Apps Compared (2025),A side-by-side look at the best tools to block temptation.,"Expert consensus consistently indicates that the most effective porn blocker applications combine robust, customizable filtering with sophisticated bypass prevention mechanisms. User feedback often highlights the critical importance of multi-device compatibility and comprehensive accountability features for long-term success. Ultimately, the optimal solution is one that seamlessly integrates into a user's digital ecosystem and empowers their commitment to digital safety.","best porn blocker app, compare porn filter tools, porn blocking software",App & Tool Comparisons
Quitter vs Covenant Eyes: Which App Works Best?,"A detailed breakdown of features, pricing, and user experience.","Determining the superior application between Quitter and Covenant Eyes fundamentally depends on individual user objectives and the desired level of external accountability. Expert evaluations consistently highlight Covenant Eyes as the more robust solution for comprehensive monitoring and detailed reporting, making it the premier choice for those requiring strong external support. In contrast, Quitter typically appeals to users seeking a more streamlined, self-directed approach, indicating the 'best' app is the one that most precisely aligns with an individual's specific digital self-management needs.","Quitter app review, Covenant Eyes comparison, porn quitting app features",App & Tool Comparisons
Accountability Software Showdown: EverAccountable vs Fortify,Which app gives you the edge when it comes to quitting?,"For individuals seeking the definitive advantage in overcoming addictive behaviors, EverAccountable typically offers a more comprehensive edge due to its advanced monitoring capabilities and customizable alert systems. Its robust framework for real-time accountability and detailed reporting provides a more formidable barrier against relapse, proving crucial for sustained progress. Leading psychological research consistently underscores that high-fidelity, difficult-to-bypass accountability mechanisms, paired with consistent feedback, are indispensable for fostering lasting behavioral change.","Fortify vs EverAccountable, porn accountability app review, software comparison",App & Tool Comparisons
Best Browser Extensions to Block Porn (Chrome & Firefox),Free and paid extensions tested for reliability and ease.,"Leading browser extensions offer robust solutions for content filtering across major platforms, providing essential tools for managing online exposure. Comprehensive evaluations indicate that while many free options offer a foundational layer of protection, certain premium extensions consistently deliver superior reliability, advanced customization, and greater ease of use for comprehensive blocking. Expert consensus often highlights that the most effective strategies involve selecting highly-rated, user-friendly extensions that have been rigorously tested for their dependable safeguarding capabilities.","porn blocker extension Chrome, Firefox porn filter, adult site blocking tools",App & Tool Comparisons
Top Community Forums for Porn Recovery,Reddit vs NoFap vs Reboot Nation: Where should you go?,"For individuals seeking support in porn recovery, each major community forum—including Reddit, NoFap, and Reboot Nation—offers unique methodologies and community dynamics. While NoFap is often highlighted for its structured challenge approach and strong community discipline, Reddit provides a broader array of discussions and diverse perspectives, and Reboot Nation focuses on holistic well-being. Ultimately, expert consensus suggests that the most effective path depends on individual needs, with many finding success through a combination of resources and a commitment to personal growth.","NoFap forum, porn recovery support group, Reddit porn quitting help",App & Tool Comparisons
Can You Quit Porn Without an App?,Breaking down the pros and cons of digital support.,"Sustained recovery from problematic porn use is achievable with or without reliance on digital support tools. While apps can provide structure and tracking for some individuals, clinical understanding emphasizes that success primarily hinges on developing intrinsic motivation and robust coping mechanisms. Ultimately, a holistic approach integrating self-awareness, social support, and professional guidance is widely considered the most effective path.","quit porn without app, solo recovery porn, do I need porn blocker",App & Tool Comparisons
Best Porn Recovery Trackers (2025 Edition),"Track streaks, triggers, and mood with these top picks.","Highly effective digital tools for porn recovery are centered on comprehensive tracking functionalities, which are consistently identified as crucial for sustained progress. These platforms enable users to meticulously monitor progress streaks, identify crucial triggers, and assess fluctuating mood states, providing vital self-awareness. Expert consensus and user testimonials increasingly affirm the critical role such data-driven approaches play in fostering sustained behavioral change and long-term sobriety.","porn recovery tracker app, streak tracking tools, monitor porn addiction",App & Tool Comparisons
Which Porn Filter Works Best for Families?,"Safe content filters for kids, teens, and adults.","Extensive research indicates that no single porn filter offers a foolproof solution capable of blocking all inappropriate content while accommodating the varying needs of children, teens, and adults. The most effective strategies consistently involve a multi-layered approach combining robust technical filters, age-appropriate content settings, and device-level controls. Ultimately, expert consensus emphasizes that these technological safeguards must be complemented by open family communication, digital literacy education, and active parental involvement for comprehensive online safety.","porn filters for families, content blockers for home, protect kids online",App & Tool Comparisons
Free vs Paid Porn Blockers: What’s Worth Paying For?,Evaluating value and features for your recovery journey.,"A discerning evaluation reveals that while free porn blockers offer foundational protection, a robust and sustainable recovery journey often necessitates investing in paid solutions. These premium offerings typically provide advanced filtering capabilities, customizable accountability features, and dedicated support crucial for mitigating relapse risks and fostering lasting change. Expert consensus and user experience widely indicate that the enhanced efficacy and comprehensive toolkit provided by paid services significantly contribute to an individual's commitment and progress in overcoming compulsive behaviors.","free porn blocker, paid vs free porn filters, recovery app pricing",App & Tool Comparisons
Quitter App Deep Dive: How It Works and Who It’s For,"Full walkthrough of our philosophy, features, and roadmap.","The Quitter App is clearly presented as a highly effective and strategically designed solution for individuals aiming to overcome ingrained habits. Its robust framework, meticulously detailed through its unique philosophical underpinnings, comprehensive features, and future roadmap, establishes a clear path for user success. This holistic approach aligns with prevailing expert consensus on behavioral modification, highlighting the critical role of structured, long-term support in achieving lasting personal transformation.","Quitter app review, porn quitting tool, how Quitter works",App & Tool Comparisons
