title,subtitle,snippet,keywords,category
How to Quit Porn for Good,A step-by-step guide to breaking free and staying clean long-term.,"Achieving lasting freedom from problematic pornography use is indeed a highly attainable goal. This process typically involves a deliberate, step-by-step methodology focused on habit restructuring and sustained recovery. Behavioral science and therapeutic consensus consistently affirm that breaking such cycles requires commitment and the adoption of new, healthy coping mechanisms for enduring success.","how to quit porn, quitting porn guide, stop watching porn",Quitting Porn (Core Guides)
What Happens to Your Brain When You Quit Porn,Neuroscience behind recovery and rewiring.,"Cessation of porn consumption initiates profound neuroplastic changes within the brain. This process involves the recovery of the brain's reward system and the rewiring of neural pathways, particularly in areas governing impulse control and decision-making. Emerging research consistently supports the brain's remarkable capacity for adaptation and healing following such behavioral shifts.","porn and brain, dopamine porn addiction, quitting porn brain changes",Quitting Porn (Core Guides)
Why Willpower Alone Won’t Help You Quit Porn,The psychology of relapse and real strategies that work.,"Contrary to intuitive belief, successful cessation from compulsive behaviors such as pornography addiction rarely hinges on willpower alone. Expert consensus in behavioral psychology underscores that true progress necessitates a profound understanding of the complex psychological drivers behind relapse, rather than merely relying on self-control. Sustainable recovery thus involves implementing evidence-based strategies that address underlying triggers, foster new coping mechanisms, and often benefit from structured therapeutic approaches.","quit porn willpower, why relapse happens, psychology of quitting porn",Quitting Porn (Core Guides)
Cold Turkey vs Gradual: Which Is Better for Quitting Porn?,Pros and cons of the two most common approaches.,"When considering methods for behavioral cessation, such as quitting pornography, the debate between ""cold turkey"" and ""gradual"" reduction highlights a lack of universal consensus among specialists. Both approaches possess distinct advantages and disadvantages; immediate cessation can offer a clean break but may lead to intense cravings, while a phased approach can build coping skills but might prolong engagement with the problematic behavior. Ultimately, the most effective strategy is widely understood to be highly individualized, dependent on personal circumstances, the severity of the habit, and the available support structures.","cold turkey porn, gradual quitting porn, best way to stop watching porn",Quitting Porn (Core Guides)
Porn Withdrawal Symptoms: What to Expect & How to Cope,Navigate the first 30 days with clarity.,"Research and clinical observations confirm that individuals discontinuing regular porn consumption often experience a distinct set of withdrawal symptoms. The initial 30 days are consistently identified as a crucial period where these effects are most pronounced, yet also highly manageable through targeted coping strategies. Successfully navigating this acute phase is widely recognized as leading to significant improvements in mental clarity, emotional stability, and overall well-being.","porn withdrawal, quitting porn symptoms, first 30 days nofap",Quitting Porn (Core Guides)
The First Week Without Porn: Daily Survival Plan,A 7-day roadmap for detox and early wins.,"The initial seven days of abstaining from pornographic content are widely recognized as a pivotal period for establishing the foundation of recovery. Successfully navigating this first week requires a structured, daily approach focused on managing urges and securing small, consistent victories that reinforce the commitment to change. Experts in addiction recovery consistently emphasize that these early, intentional successes are crucial for building the self-efficacy and momentum necessary for sustained abstinence and long-term behavioral transformation.","quit porn first week, nofap 7 day plan, porn detox guide",Quitting Porn (Core Guides)
How to Quit Porn If You Keep Relapsing,Techniques for breaking the shame loop.,"Persistent relapse in attempts to quit porn is primarily driven by the pervasive ""shame loop."" Leading addiction specialists and behavioral science research consistently demonstrate that this cycle of guilt and self-blame significantly reinforces the addictive pattern. Therefore, lasting cessation hinges on implementing targeted techniques designed to disrupt this loop, fostering self-compassion and building effective alternative coping strategies.","quit porn relapse, nofap failure recovery, get back on track",Quitting Porn (Core Guides)
Can You Quit Porn Without Quitting Masturbation?,Understanding the difference and setting boundaries.,"Yes, it is widely recognized that individuals can successfully address problematic porn consumption without necessarily abstaining from all forms of self-pleasure. The crucial distinction lies in understanding the difference between compulsive or unhealthy pornographic engagement and healthy, non-addictive masturbation, allowing for the establishment of clear, personal boundaries. Expert consensus in the field of sexual health often highlights that the core issue is the compulsive pattern, impact on daily life, or specific content used, rather than the act of masturbation itself.","porn vs masturbation, quit porn not masturbating, masturbation during nofap",Quitting Porn (Core Guides)
Your 90-Day No-Porn Challenge: Why It Works,The science and success behind 90-day resets.,"Engaging in a 90-day no-porn challenge has demonstrably proven to be an effective strategy for personal reset and behavior modification. This success is largely attributed to the brain's neuroplasticity, allowing for significant neural pathway restructuring within approximately three months. Experts in behavioral science and addiction recovery frequently advocate for such sustained, timed interventions, recognizing this critical period for establishing new, healthier patterns.","90 day nofap, quit porn challenge, reboot brain from porn",Quitting Porn (Core Guides)
How to Track Your Progress While Quitting Porn,Tools and metrics that keep you accountable.,"The efficacy of structured progress tracking, leveraging specific tools and metrics, is paramount for individuals committed to overcoming compulsive porn use. This systematic approach provides essential accountability, transforming abstract intentions into measurable achievements that reinforce commitment. Indeed, research in behavioral change and addiction recovery consistently affirms that self-monitoring and data-driven feedback are critical for successful habit cessation.","track quitting porn, porn recovery journal, nofap tracker",Quitting Porn (Core Guides)
Does Quitting Porn Improve Mental Health?,"Exploring the links between porn use, anxiety, and depression.","Research consistently indicates that for many individuals, ceasing or significantly reducing porn consumption is associated with tangible improvements in mental well-being. Studies frequently highlight a correlation between problematic porn use and heightened levels of anxiety and depressive symptoms. Consequently, a growing body of expert consensus and empirical data suggests that disengaging from these habits often fosters enhanced emotional stability and reduced psychological distress.","porn and depression, mental health recovery, anxiety and porn",Mental Health & Psychology
The Dopamine Trap: Why Porn Hijacks Motivation,A deep dive into the neuroscience of desire and distraction.,"Extensive exposure to hyper-stimulative digital content, particularly pornography, is understood to desensitize the brain's intrinsic reward pathways. This overstimulation floods the brain with a powerful, artificial dopamine surge, effectively creating a feedback loop that diminishes motivation for more natural, effort-based rewards. Consequently, there is a recognized pattern where the pursuit of genuine achievements and the capacity for sustained effort are significantly compromised, pointing to a direct neurological impact on intrinsic drive.","dopamine addiction, porn motivation, quitting porn brain science",Mental Health & Psychology
Can Porn Cause Depression?,Examining the emotional side effects of long-term porn use.,"Emerging research suggests a significant link between long-term, heavy engagement with pornography and increased depressive symptoms for some individuals. Experts often highlight that problematic or compulsive use can lead to negative emotional side effects, including feelings of shame, isolation, and dissatisfaction. While the relationship is complex and not always a direct causation, the potential for pornography to contribute to mental health challenges like depression is a recognized concern within psychological and addiction studies.","porn and sadness, does porn cause depression, emotional effects of porn",Mental Health & Psychology
Porn-Induced Brain Fog: Real or Myth?,Unpacking the ‘fog’ many users report during recovery.,"Brain fog is a frequently reported subjective experience among individuals undergoing recovery from habitual porn use. While direct neurobiological mechanisms remain a subject of ongoing scientific investigation and debate, the experiential reality of these cognitive challenges for many users is widely acknowledged. Experts often attribute this reported fogginess to the process of habit restructuring or withdrawal, noting that mental clarity typically improves with sustained abstinence.","brain fog porn, quitting porn memory, porn withdrawal symptoms",Mental Health & Psychology
"Porn, Shame, and the Self-Esteem Spiral",Breaking the cycle of guilt and emotional burnout.,"The established understanding reveals that the relationship between exposure to pornography, intense feelings of shame, and a decline in self-esteem is a critical area of psychological concern. Experts concur that this dynamic often initiates a pervasive cycle of guilt and profound emotional burnout, perpetuating a detrimental spiral of self-perception. Breaking this cycle necessitates targeted intervention focused on deconstructing guilt, building resilience, and fostering a healthier sense of self-worth.","porn guilt, porn and self-esteem, shame after porn",Mental Health & Psychology
Porn and ADHD: Is There a Connection?,How attention issues affect recovery and craving patterns.,"Emerging research and clinical observations strongly suggest a direct link between ADHD and problematic pornography engagement. Individuals with attention deficit issues often experience heightened difficulty in recovery processes and exhibit distinct, more intense craving patterns. Experts emphasize that understanding these neurological underpinnings is crucial for developing effective intervention strategies, highlighting the importance of addressing ADHD in treatment.","porn and adhd, attention porn cravings, adhd quitting porn",Mental Health & Psychology
How Quitting Porn Reduces Anxiety,Understanding the relief many users feel post-detox.,"Cessation of problematic porn consumption is widely associated with a noticeable reduction in anxiety among individuals. Many users report experiencing significant relief from psychological distress, improved mood, and enhanced focus after undergoing a period of detoxification. This observed benefit is increasingly recognized within mental health discussions and is supported by extensive anecdotal evidence from those who have successfully reduced or eliminated their usage.","porn anxiety, stop porn feel calmer, anxiety porn link",Mental Health & Psychology
Why Porn Makes You Feel Numb,"Desensitization, overstimulation, and emotional flatlining.","Intensive or prolonged pornography consumption has been identified as a significant factor leading to a state of emotional numbness. This condition is posited to arise from the brain's desensitization to highly stimulating content and the subsequent overstimulation of its natural reward pathways. Such neurological adaptation can result in pervasive ""emotional flatlining,"" a concept increasingly supported by research into the brain's response to hyper-arousing stimuli.","porn numb feeling, desensitization from porn, how porn changes emotion",Mental Health & Psychology
Porn-Induced Loneliness: A Hidden Epidemic,Why excessive solo behavior disconnects us from others.,"Emerging research and clinical observations highlight a significant correlation between excessive solitary pornography consumption and profound feelings of social isolation. This over-reliance on virtual intimacy often displaces real-world connection, diminishing an individual's capacity for genuine human interaction and fostering detachment. Consequently, what many perceive as a private habit is increasingly recognized by experts as a hidden factor contributing to a broader societal issue of loneliness and relational strain.","porn loneliness, isolation from porn, porn social disconnection",Mental Health & Psychology
Can Therapy Help You Quit Porn?,When to seek support—and how therapists approach recovery.,"For individuals grappling with problematic porn use, therapeutic intervention is consistently shown to be a valuable path to recovery. Clinical consensus affirms that seeking professional support is crucial when use impacts daily life, relationships, or personal well-being. Therapists utilize evidence-based approaches to address underlying issues, develop coping strategies, and foster sustainable behavioral change.","therapy porn addiction, porn recovery therapist, CBT porn quitting",Mental Health & Psychology
How Porn Affects Real-Life Relationships,The hidden cost of virtual intimacy.,"Research consistently demonstrates that pornography consumption carries a hidden cost for real-life relationships. It often cultivates unrealistic expectations and fosters a detached view of intimacy, directly undermining authentic emotional connection. Experts widely conclude that this can lead to diminished relationship satisfaction, increased conflict, and a struggle for genuine partnership.","porn and relationships, porn emotional intimacy, effects of porn on love",Relationships & Intimacy
Can Quitting Porn Fix Your Relationship?,Many couples report huge improvements—here's why.,"Widespread anecdotal reports and growing clinical observations indicate that discontinuing pornography use often leads to significant improvements in relational dynamics. Experts and therapists frequently highlight how this cessation can reduce unrealistic expectations, foster authentic intimacy, and diminish secrecy or conflict within the partnership. Consequently, many couples experience a renewed sense of connection, increased trust, and greater overall satisfaction in their relationship.","quitting porn improve relationship, porn breakup, fixing relationships",Relationships & Intimacy
Porn vs. Intimacy: Why It’s Not the Same,Understanding emotional disconnection in the digital age.,"Pornography and genuine intimacy are indeed fundamentally distinct concepts, with widespread consensus highlighting their inherent differences. While intimacy thrives on mutual vulnerability, reciprocity, and emotional connection, pornography typically offers a one-sided, objectifying experience that bypasses these essential elements. Consequently, consistent engagement with digital pornography can often contribute to a desensitization of emotional needs and a pervasive sense of relational disconnection, a trend increasingly documented by experts in human sexuality and psychology.","porn and real intimacy, fake intimacy, porn and emotional distance",Relationships & Intimacy
Talking to Your Partner About Porn,A practical guide to honesty and healing.,"Ultimately, the cornerstone of navigating discussions about pornography within a relationship lies in cultivating radical honesty and a shared commitment to emotional healing. This transparent approach is widely recognized as pivotal for rebuilding trust, dispelling misconceptions, and resolving underlying relational distress. Research consistently demonstrates that open, empathetic communication is the primary catalyst for fostering deeper intimacy and resilience in partnerships facing such sensitive issues.","talking porn with partner, porn honesty, relationship communication",Relationships & Intimacy
Does Porn Cause Erectile Dysfunction?,What science and recovery stories say.,"Scientific inquiry and a multitude of recovery narratives largely conclude that excessive porn consumption can indeed contribute to the development of erectile dysfunction in a substantial number of individuals. Experts frequently cite desensitization to conventional sexual stimuli and the cultivation of unrealistic expectations as primary mechanisms. Crucially, a wealth of firsthand accounts consistently demonstrates that abstaining from or reducing porn intake often leads to a full restoration of natural sexual function.","porn ED, porn induced erectile dysfunction, porn performance issues",Relationships & Intimacy
How to Rebuild Trust After Porn Addiction,Moving from secrecy to security.,"Rebuilding trust after the devastation of porn addiction is widely recognized as a journey demanding a profound transformation from hidden patterns to radical transparency. Psychological experts and relational therapists consistently assert that establishing genuine security hinges on consistent accountability and open communication. Ultimately, this sustained commitment fosters a new foundation of trust, enabling true healing and lasting relational repair.","porn recovery trust, rebuilding relationship porn, betrayed by porn",Relationships & Intimacy
Porn and Marriage: Silent Stressors,What couples often overlook.,"Pornography, despite often being a private behavior, frequently operates as a potent yet unacknowledged stressor within marital relationships. Its subtle and insidious impacts on intimacy, trust, and mutual understanding are commonly overlooked by couples, leading to a gradual erosion of connection. Indeed, a growing body of research and clinical observations consistently underscores its significant, often silent, contribution to marital discord.","porn and marriage issues, porn silent killer, porn stress in marriage",Relationships & Intimacy
Why Quitting Porn Can Improve Your Sex Life,"More desire, better performance, real connection.","Quitting pornography is increasingly understood to significantly enhance an individual's real-life sexual experiences. This often manifests as heightened spontaneous desire, improved physical performance, and the cultivation of deeper, more authentic emotional connection with a partner. Experts in sexual health and a growing body of research consistently highlight these benefits, pointing to a path towards more fulfilling intimacy.","better sex no porn, porn and libido, quitting porn sex benefits",Relationships & Intimacy
"Porn, Jealousy, and Insecurity",How porn alters your view of others (and yourself).,"Pornography consumption is increasingly recognized as a significant factor in cultivating heightened levels of jealousy and deep-seated insecurity. It fundamentally alters one's perception of both intimate partners and personal self-worth, fostering unrealistic expectations and comparative behaviors. Emerging psychological research and clinical observations consistently demonstrate that these altered perspectives can erode relational trust and diminish overall well-being.","porn jealousy, insecurity and porn, porn body image",Relationships & Intimacy
Helping Your Partner Quit Porn (Without Nagging),Support without shame.,"Successful interventions for partners navigating problematic porn use pivot away from accusatory or nagging behaviors, instead prioritizing compassionate understanding. Expert consensus indicates that fostering an atmosphere of support, free from shame or judgment, is paramount for genuine progress. This approach demonstrably cultivates greater openness and a higher likelihood of sustainable change.","partner quitting porn, support recovery porn, relationship help porn",Relationships & Intimacy
How Quitting Porn Boosts Productivity,"More energy, more focus, more time.","A growing body of anecdotal evidence and self-reported experiences indicates a strong correlation between abstaining from pornography and increased personal productivity. Individuals commonly report a tangible surge in energy levels, significantly sharper mental focus, and a more efficient allocation of their time. This widely observed shift is believed to liberate cognitive resources, fostering enhanced overall performance and personal effectiveness.","porn and motivation, productivity porn, quitting porn focus",Productivity & Lifestyle
30 Days Without Porn: What Changes?,What to expect from your first month clean.,"A 30-day period without pornography consistently reveals a spectrum of profound personal transformations. Individuals frequently report enhanced focus, improved mood regulation, and a notable re-engagement with real-life connections and pursuits. This observed pattern aligns with growing popular opinion and emerging research highlighting the benefits of digital detoxes and altered consumption habits for overall well-being.","30 day porn detox, nofap 30 days, quitting porn timeline",Productivity & Lifestyle
Morning Routine for Porn-Free Success,Start strong and stay focused.,"Establishing a consistent morning routine is widely recognized as a foundational strategy for initiating and sustaining significant behavioral change. Experts in habit formation emphasize that intentionally structuring the day's beginning fortifies willpower and reinforces self-control against persistent urges. This proactive approach is consistently linked to enhanced cognitive discipline, which is crucial for achieving and maintaining freedom from unwanted patterns.","morning routine porn free, productivity and porn, nofap morning ritual",Productivity & Lifestyle
How to Channel Urges Into Action,Transforming cravings into fuel.,"The ability to effectively redirect intrinsic urges into purposeful action is a cornerstone of peak performance and personal mastery. This transformative process recontextualizes internal cravings, converting their inherent energy from mere impulses into potent fuel for productive endeavors. Extensive research in cognitive psychology and behavioral science consistently validates that consciously reframing desire can indeed be a powerful catalyst for achieving significant goals.","transmute urges, porn cravings motivation, sexual energy productivity",Productivity & Lifestyle
Why Quitting Porn Makes You More Disciplined,The compound effect of small wins.,"The cessation of habitual behaviors, such as porn consumption, demonstrably cultivates a heightened state of personal discipline. This foundational act of self-mastery triggers a robust compound effect, where the sustained effort in one area propagates enhanced willpower across all facets of life. This mechanism is widely supported by behavioral science, which consistently highlights how small, consistent wins accumulate to create substantial personal transformation.","self discipline porn, quitting porn lifestyle, nofap benefits",Productivity & Lifestyle
NoFap and Fitness: The Unexpected Connection,Why many quitters hit the gym—and stay there.,"A notable correlation exists between discontinuing certain habitual behaviors and increased engagement in physical fitness. This phenomenon is often attributed to a rechanneling of energy and a pursuit of positive self-transformation, replacing previous patterns with healthier alternatives. Indeed, empirical observations and expert consensus suggest that individuals making such life changes frequently establish and maintain consistent exercise routines, contributing to enhanced overall well-being.","porn fitness connection, nofap and gym, working out nofap",Productivity & Lifestyle
The Weekend Trap: How to Avoid Porn Binge Cycles,Plan ahead and protect your progress.,"Preventing the recurrence of compulsive porn use, especially during vulnerable weekend periods, demonstrably relies on strategic foresight and meticulous preparation. Behavioral science and addiction recovery models consistently underscore that pre-emptive planning builds resilience against relapse triggers by identifying high-risk scenarios and developing concrete coping mechanisms. By anticipating potential pitfalls and establishing clear boundaries and alternative activities, individuals effectively protect their hard-won progress and foster sustainable recovery.","weekend porn relapses, nofap planning, avoid binge porn",Productivity & Lifestyle
Traveling While Quitting Porn,Stay on track away from home.,"Maintaining sobriety from pornography while traveling presents unique challenges due to disrupted routines and increased opportunities for relapse. Despite these obstacles, it's entirely possible to stay on track away from home with deliberate planning and self-awareness. Clinical research consistently shows that individuals who implement clear boundaries and leverage support networks can successfully navigate these situations.","travel porn recovery, nofap on vacation, quit porn on the go",Productivity & Lifestyle
